{
  "case_id": "token_budget.check.g4_7",
  "priority": "P2",
  "modules": [
    "various"
  ],
  "description": "tb g4_7",
  "entrypoint": {
    "kind": "module",
    "module_func": "token_budget.check",
    "module_kwargs": {
      "agent_id": null,
      "budget": 10,
      "tokens": 9
    }
  },
  "mocks": {
    "model": {}
  },
  "expected": {
    "exit_code": 0
  },
  "policy": {
    "ignore_fields": [],
    "tolerance": {},
    "blocking": false
  }
}