{
  "case_id": "permission.has_wildcards.has_question",
  "priority": "P2",
  "modules": [
    "various.ts",
    "hare/various.py"
  ],
  "description": "hasWildcards 'has?question'",
  "entrypoint": {
    "kind": "module",
    "module_func": "permission.has_wildcards",
    "module_kwargs": {
      "pattern": "has?question"
    }
  },
  "mocks": {
    "model": {}
  },
  "expected": {
    "exit_code": 0
  },
  "policy": {
    "ignore_fields": [],
    "tolerance": {},
    "blocking": true
  }
}
