{
  "case_id": "permission.match_wildcard.file___file",
  "priority": "P2",
  "modules": [
    "various.ts",
    "hare/various.py"
  ],
  "description": "matchWildcard 'file.*' 'file'",
  "entrypoint": {
    "kind": "module",
    "module_func": "permission.match_wildcard",
    "module_kwargs": {
      "pattern": "file.*",
      "command": "file"
    }
  },
  "mocks": {
    "model": {}
  },
  "expected": {
    "exit_code": 0
  },
  "policy": {
    "ignore_fields": [],
    "tolerance": {},
    "blocking": false
  }
}
