{
  "case_id": "history.format_pasted_ref.id7_n3",
  "priority": "P2",
  "modules": [
    "various.ts",
    "hare/various.py"
  ],
  "description": "formatPastedTextRef id=7 numLines=3",
  "entrypoint": {
    "kind": "module",
    "module_func": "history.format_pasted_ref",
    "module_kwargs": {
      "id": 7,
      "num_lines": 3
    }
  },
  "mocks": {
    "model": {}
  },
  "expected": {
    "exit_code": 0
  },
  "policy": {
    "ignore_fields": [],
    "tolerance": {},
    "blocking": false
  }
}