{
  "case_id": "history.parse_references.text_with__paste__42__inline_4",
  "priority": "P2",
  "modules": [
    "various.ts",
    "hare/various.py"
  ],
  "description": "parseReferences 'text with {paste #42} inline'",
  "entrypoint": {
    "kind": "module",
    "module_func": "history.parse_references",
    "module_kwargs": {
      "input_text": "text with {paste #42} inline"
    }
  },
  "mocks": {
    "model": {}
  },
  "expected": {
    "exit_code": 0
  },
  "policy": {
    "ignore_fields": [],
    "tolerance": {},
    "blocking": false
  }
}
