{
  "case_id": "token_budget.check.budget_none",
  "priority": "P2",
  "modules": [
    "various.ts",
    "hare/various.py"
  ],
  "description": "checkTokenBudget budget_none",
  "entrypoint": {
    "kind": "module",
    "module_func": "token_budget.check",
    "module_kwargs": {
      "agent_id": null,
      "budget": 0,
      "tokens": 500
    }
  },
  "mocks": {
    "model": {}
  },
  "expected": {
    "exit_code": 0
  },
  "policy": {
    "ignore_fields": [],
    "tolerance": {},
    "blocking": false
  }
}