{
  "case_id": "token_budget.check.anone_b1000_t900",
  "priority": "P2",
  "modules": [
    "various.ts",
    "hare/various.py"
  ],
  "description": "checkTokenBudget agent=None budget=1000 tokens=900",
  "entrypoint": {
    "kind": "module",
    "module_func": "token_budget.check",
    "module_kwargs": {
      "agent_id": null,
      "budget": 1000,
      "tokens": 900
    }
  },
  "mocks": {
    "model": {}
  },
  "expected": {
    "exit_code": 0
  },
  "policy": {
    "ignore_fields": [],
    "tolerance": {},
    "blocking": true
  }
}
