{
  "case_id": "history.parse_references._paste__1___paste__1__8",
  "priority": "P2",
  "modules": [
    "various.ts",
    "hare/various.py"
  ],
  "description": "parseReferences '{paste #1} {paste #1}'",
  "entrypoint": {
    "kind": "module",
    "module_func": "history.parse_references",
    "module_kwargs": {
      "input_text": "{paste #1} {paste #1}"
    }
  },
  "mocks": {
    "model": {}
  },
  "expected": {
    "exit_code": 0
  },
  "policy": {
    "ignore_fields": [],
    "tolerance": {},
    "blocking": false
  }
}
