{
  "case_id": "permission.unescape_rule.__",
  "priority": "P2",
  "modules": [
    "various.ts",
    "hare/various.py"
  ],
  "description": "unescapeRuleContent '\\\\'",
  "entrypoint": {
    "kind": "module",
    "module_func": "permission.unescape_rule",
    "module_kwargs": {
      "content": "\\\\"
    }
  },
  "mocks": {
    "model": {}
  },
  "expected": {
    "exit_code": 0
  },
  "policy": {
    "ignore_fields": [],
    "tolerance": {},
    "blocking": true
  }
}
