{
  "case_id": "permission.match_wildcard.plnabcrat_czat",
  "priority": "P2",
  "modules": [
    "various.ts",
    "hare/various.py"
  ],
  "description": "matchWildcard pattern='[!abc]at' command='zat'",
  "entrypoint": {
    "kind": "module",
    "module_func": "permission.match_wildcard",
    "module_kwargs": {
      "pattern": "[!abc]at",
      "command": "zat"
    }
  },
  "mocks": {
    "model": {}
  },
  "expected": {
    "exit_code": 0
  },
  "policy": {
    "ignore_fields": [],
    "tolerance": {},
    "blocking": true
  }
}
