{
  "case_id": "permission.match_wildcard.pa_b_ss_c_ca_b_c",
  "priority": "P2",
  "modules": [
    "various.ts",
    "hare/various.py"
  ],
  "description": "matchWildcard pattern='a/b/**/c' command='a/b/c'",
  "entrypoint": {
    "kind": "module",
    "module_func": "permission.match_wildcard",
    "module_kwargs": {
      "pattern": "a/b/**/c",
      "command": "a/b/c"
    }
  },
  "mocks": {
    "model": {}
  },
  "expected": {
    "exit_code": 0
  },
  "policy": {
    "ignore_fields": [],
    "tolerance": {},
    "blocking": true
  }
}
