{
  "case_id": "permission.match_wildcard.no_match",
  "priority": "P2",
  "modules": [
    "various.ts",
    "hare/various.py"
  ],
  "description": "matchWildcardPattern pattern='rm *' cmd='ls'",
  "entrypoint": {
    "kind": "module",
    "module_func": "permission.match_wildcard",
    "module_kwargs": {
      "pattern": "rm *",
      "command": "ls"
    }
  },
  "mocks": {
    "model": {}
  },
  "expected": {
    "exit_code": 0
  },
  "policy": {
    "ignore_fields": [],
    "tolerance": {},
    "blocking": false
  }
}