{
  "case_id": "cli.print.stream_json_event_order",
  "priority": "P0",
  "modules": [
    "cli/print.ts",
    "cli/structuredIO.ts",
    "hare/cli/print_handler.py",
    "hare/cli/structured_io.py",
    "hare/entrypoints/cli.py",
    "hare/main.py",
    "hare/query/core.py"
  ],
  "description": "Print mode with stream-json format returns ordered NDJSON events from model response",
  "entrypoint": {
    "kind": "query"
  },
  "env": {
    "TZ": "UTC",
    "LANG": "C.UTF-8"
  },
  "mocks": {
    "model": {
      "turns": [
        {
          "stop_reason": "end_turn",
          "content": [
            {
              "type": "text",
              "text": "Hello! I'm Claude, an AI assistant."
            }
          ]
        },
        {
          "stop_reason": "end_turn",
          "content": [
            {
              "type": "text",
              "text": "How can I help you today?"
            }
          ]
        }
      ]
    },
    "network": "deny",
    "subprocess": "deny",
    "max_turns": 5
  },
  "expected": {
    "exit_code": 0,
    "stdout_kind": "ndjson"
  },
  "policy": {
    "ignore_fields": [],
    "tolerance": {},
    "blocking": true,
    "allow_delta": [
      {
        "path": "stdout",
        "reason": "Phase 2: stdout format differs between TS/Py wrappers",
        "expires_at": "2099-01-01",
        "kind": "text"
      },
      {
        "path": "events",
        "reason": "Phase 2: event structure differs between TS/Py query loop wrappers, content semantics match",
        "expires_at": "2099-01-01",
        "kind": "text"
      }
    ]
  }
}