{
  "case_id": "history.parse_references.complex",
  "priority": "P2",
  "modules": [
    "various.ts",
    "hare/various.py"
  ],
  "description": "parseReferences with complex",
  "entrypoint": {
    "kind": "module",
    "module_func": "history.parse_references",
    "module_kwargs": {
      "input_text": "User: [Pasted text #1] then [Image #2] and [.Truncated text #3.] done"
    }
  },
  "mocks": {
    "model": {}
  },
  "expected": {
    "exit_code": 0
  },
  "policy": {
    "ignore_fields": [],
    "tolerance": {},
    "blocking": false
  }
}