{
  "case_id": "hooks.is_blocked.198_51_100_1",
  "priority": "P2",
  "modules": [
    "various.ts",
    "hare/various.py"
  ],
  "description": "isBlockedAddress '198.51.100.1'",
  "entrypoint": {
    "kind": "module",
    "module_func": "hooks.is_blocked_address",
    "module_kwargs": {
      "address": "198.51.100.1"
    }
  },
  "mocks": {
    "model": {}
  },
  "expected": {
    "exit_code": 0
  },
  "policy": {
    "ignore_fields": [],
    "tolerance": {},
    "blocking": true
  }
}
