{
  "case_id": "cost.tracker.check_1",
  "priority": "P1",
  "modules": [
    "query/tokenBudget.ts",
    "hare/query/token_budget.py"
  ],
  "description": "cost tracker check 1",
  "entrypoint": {
    "kind": "module",
    "module_func": "token_budget.check",
    "module_kwargs": {
      "agent_id": null,
      "budget": 1000,
      "tokens": 500
    }
  },
  "mocks": {
    "model": {}
  },
  "expected": {
    "exit_code": 0
  },
  "policy": {
    "ignore_fields": [],
    "tolerance": {},
    "blocking": true,
    "allow_delta": [
      {
        "path": "events",
        "reason": "Structure matches, content may differ",
        "expires_at": "2099-01-01",
        "kind": "text"
      }
    ]
  }
}