{
  "case_id": "permission.match_wildcard.g4_12",
  "priority": "P2",
  "modules": [
    "various"
  ],
  "description": "match g4_12",
  "entrypoint": {
    "kind": "module",
    "module_func": "permission.match_wildcard",
    "module_kwargs": {
      "pattern": "diff *",
      "command": "diff a b"
    }
  },
  "mocks": {
    "model": {}
  },
  "expected": {
    "exit_code": 0
  },
  "policy": {
    "ignore_fields": [],
    "tolerance": {},
    "blocking": false
  }
}